"acronym";"title";"ranksys";"rank";"field"
"AAAI";"National Conference of the American Association for Artificial Intelligence";"CORE2023";"A*";"Artificial intelligence"
"AAMAS";"International Joint Conference on Autonomous Agents and Multiagent Systems";"CORE2023";"A*";"Artificial intelligence"
"ACCV";"Asian Conference on Computer Vision";"CORE2023";"B";"Computer vision and multimedia computation"
"ACIIDS";"Asian Conference on Intelligent Information and Database Systems";"CORE2023";"B";"Data management and data science"
"ACIVS";"Advanced Concepts for Intelligent Vision Systems";"CORE2023";"B";"Computer vision and multimedia computation"
"ACL";"Association for Computational Linguistics";"CORE2023";"A*";"Artificial intelligence"
"ACMMM";"ACM Multimedia";"CORE2023";"A*";"Computer vision and multimedia computation"
"AISTATS";"International Conference on Artificial Intelligence and Statistics";"CORE2023";"A";"Machine learning"
"ALT";"Algorithmic Learning Theory";"CORE2023";"B";"Machine learning"
"ASONAM";"IEEE/ACM International Conference on Advances in Social Networks Analysis and Mining";"CORE2023";"B";"Data management and data science"
"AVSS";"IEEE International Conference on Advanced Video and Signal Based Surveillance";"CORE2023";"B";"Computer vision and multimedia computation"
"BMVC";"British Machine Vision Conference";"CORE2023";"A";"Computer vision and multimedia computation"
"BigData";"IEEE International Conference on Big Data";"CORE2023";"B";"Data management and data science"
"CADE";"International Conference on Automated Deduction";"CORE2023";"A";"Artificial intelligence"
"CEC";"IEEE Congress on Evolutionary Computation";"CORE2023";"B";"Artificial intelligence"
"CIDR";"Conference on Innovative Data Systems Research";"CORE2023";"A";"Data management and data science"
"CIKM";"ACM International Conference on Information and Knowledge Management";"CORE2023";"A";"Data management and data science"
"COLING";"International Conference on Computational Linguistics";"CORE2023";"B";"Artificial intelligence"
"COLT";"Conference on Learning Theory";"CORE2023";"A*";"Machine learning"
"CP";"International Conference on Principles and Practice of Constraint Programming";"CORE2023";"A";"Artificial intelligence"
"CPAIOR";"International Conference on Integration of Artificial Intelligence and Operations Research Techniques in Constraint Programming for Combinatorial Optimization Problems";"CORE2023";"B";"Artificial intelligence"
"CPM";"Combinatorial Pattern Matching";"CORE2023";"B";"Computer vision and multimedia computation"
"CVPR";"IEEE Conference on Computer Vision and Pattern Recognition";"CORE2023";"A*";"Computer vision and multimedia computation"
"CaiSE";"International Conference on Advanced Information Systems Engineering";"CORE2023";"A";"Data management and data science"
"CoNLL";"Conference on Computational Natural Language Learning";"CORE2023";"B";"Artificial intelligence"
"CogSci";"Annual Meeting of the Cognitive Science Society";"CORE2023";"B";"Artificial intelligence"
"DAS";"International Workshop on Document Analysis Systems";"CORE2023";"B";"Data management and data science"
"DASFAA";"International Conference on Database Systems for Advanced Applications";"CORE2023";"B";"Data management and data science"
"DCC";"Data Compression Conference";"CORE2023";"B";"Data management and data science"
"DS";"Discovery Science";"CORE2023";"B";"Machine learning"
"DSAA";"IEEE International Conference on Data Science and Advanced Analytics";"CORE2023";"B";"Data management and data science"
"DaWaK";"Data Warehousing and Knowledge Discovery";"CORE2023";"B";"Data management and data science"
"DocEng";"ACM Symposium on Document Engineering";"CORE2023";"B";"Data management and data science"
"EACL";"European Association for Computational Linguistics";"CORE2023";"A";"Artificial intelligence"
"EC";"ACM Conference on Economics and Computation";"CORE2023";"A*";"Artificial intelligence"
"ECAI";"European Conference on Artificial Intelligence";"CORE2023";"A";"Artificial intelligence"
"ECCV";"European Conference on Computer Vision";"CORE2023";"A*";"Computer vision and multimedia computation"
"ECIR";"European Conference on Information Retrieval";"CORE2023";"A";"Data management and data science"
"ECML PKDD";"European Conference on Machine Learning and Principles and Practice of Knowledge Discovery in Database";"CORE2023";"A";"Machine learning"
"EDBT";"Extending Database Technology";"CORE2023";"A";"Data management and data science"
"EKAW";"International Conference on Knowledge Engineering and Knowledge Management";"CORE2023";"B";"Data management and data science"
"EMAS";"EMAS";"CORE2023";"B";"Artificial intelligence"
"EMNLP";"Empirical Methods in Natural Language Processing";"CORE2023";"A*";"Artificial intelligence"
"ER";"International Conference on Conceptual Modelling";"CORE2023";"A";"Data management and data science"
"ESANN";"European Symposium on Artificial Neural Networks";"CORE2023";"B";"Machine learning"
"ESWC";"Extended Semantic Web Conference";"CORE2023";"B";"Data management and data science"
"EUROGP";"European Conference on Genetic Programming";"CORE2023";"B";"Artificial intelligence"
"EvoApplications";"International Conference on Applications of Evolutionary Computation";"CORE2023";"B";"Artificial intelligence"
"EvoCOP";"European Conference on Evolutionary Computation in Combinatorial Optimisation";"CORE2023";"B";"Artificial intelligence"
"FAST";"Conference on File and Storage Technologies";"CORE2023";"A";"Data management and data science"
"FG";"IEEE International Conference on Automatic Face and Gesture Recognition";"CORE2023";"B";"Computer vision and multimedia computation"
"FOGA";"Foundations of Genetic Algorithms";"CORE2023";"A";"Artificial intelligence"
"FOIS";"International Conference on Formal Ontology in Information Systems";"CORE2023";"B";"Artificial intelligence"
"FSR";"International Conference on Field and Service Robotics";"CORE2018";"A";"Artificial intelligence"
"FUZZ-IEEE";"IEEE International Conference on Fuzzy Systems";"CORE2023";"B";"Artificial intelligence"
"GECCO";"Genetic and Evolutionary Computations";"CORE2023";"A";"Artificial intelligence"
"ICAART";"International Conference on Agents and Artificial Intelligence";"CORE2023";"B";"Artificial intelligence"
"ICAPS";"International Conference on Automated Planning and Scheduling";"CORE2023";"A*";"Artificial intelligence"
"ICASSP";"IEEE International Conference on Acoustics, Speech and Signal Processing";"CORE2023";"B";"Computer vision and multimedia computation"
"ICCCI";"International Conference on Computational Collective Intelligence";"CORE2023";"B";"Artificial intelligence"
"ICCV";"IEEE International Conference on Computer Vision";"CORE2023";"A*";"Computer vision and multimedia computation"
"ICDAR";"IEEE International Conference on Document Analysis and Recognition";"CORE2023";"A";"Data management and data science"
"ICDE";"International Conference on Data Engineering";"CORE2023";"A*";"Data management and data science"
"ICDM";"IEEE International Conference on Data Mining";"CORE2023";"A*";"Data management and data science"
"ICDT";"International Conference on Database Theory";"CORE2023";"A";"Data management and data science"
"ICFHR";"International Conference on Frontiers of Handwriting Recognition";"CORE2023";"B";"Computer vision and multimedia computation"
"ICIP";"IEEE International Conference on Image Processing";"CORE2023";"B";"Computer vision and multimedia computation"
"ICLR";"International Conference on Learning Representations";"CORE2023";"A*";"Machine learning"
"ICME";"IEEE International Conference on Multimedia and Expo";"CORE2023";"A";"Computer vision and multimedia computation"
"ICML";"International Conference on Machine Learning";"CORE2023";"A*";"Machine learning"
"ICMR";"International Conference on Multimedia Retrieval";"CORE2023";"B";"Computer vision and multimedia computation"
"ICONIP";"International Conference on Neural Information Processing";"CORE2023";"B";"Machine learning"
"ICPM";"International Conference on Process Mining";"CORE2023";"B";"Data management and data science"
"ICPR";"International Conference on Pattern Recognition";"CORE2023";"B";"Computer vision and multimedia computation"
"ICRA";"IEEE International Conference on Robotics and Automation";"CORE2023";"A*";"Artificial intelligence"
"ICTAI";"International Conference on Tools with Artificial Intelligence";"CORE2023";"B";"Artificial intelligence"
"ICWE";"International Conference on Web Engineering";"CORE2023";"B";"Data management and data science"
"IDA";"Intelligent Data Analysis";"CORE2023";"B";"Data management and data science"
"IE";"The International Conference on Intelligent Environments";"CORE2023";"B";"Artificial intelligence"
"IJCAI";"International Joint Conference on Artificial Intelligence";"CORE2023";"A*";"Artificial intelligence"
"IJCAR";"International Joint Conference on Automated Reasoning";"CORE2023";"A";"Artificial intelligence"
"IJCB";"International Joint Conference on Biometrics";"CORE2023";"B";"Computer vision and multimedia computation"
"IJCNLP";"International Joint Conference on Natural Language Processing";"CORE2023";"B";"Artificial intelligence"
"IJCNN";"IEEE International Joint Conference on Neural Networks";"CORE2023";"B";"Machine learning"
"INLG";"International Natural Language Generation Conference";"CORE2023";"B";"Artificial intelligence"
"IROS";"IEEE/RSJ International Conference on Intelligent Robots and Systems";"CORE2023";"A";"Artificial intelligence"
"ISWC";"International Semantic Web Conference";"CORE2023";"A";"Data management and data science"
"IV";"Intelligent Vehicles Conference";"CORE2023";"B";"Artificial intelligence"
"IVA";"Intelligent Virtual Agents";"CORE2023";"B";"Artificial intelligence"
"Interspeech";"Interspeech";"CORE2023";"A";"Artificial intelligence"
"K-CAP";"Knowledge capture";"CORE2023";"B";"Data management and data science"
"KDD";"ACM International Conference on Knowledge Discovery and Data Mining";"CORE2023";"A*";"Data management and data science"
"KES";"International Conference on Knowledge-Based and Intelligent Information and Engineering Systems";"CORE2023";"B";"Artificial intelligence"
"KR";"International Conference on the Principles of Knowledge Representation and Reasoning";"CORE2023";"A*";"Artificial intelligence"
"LPNMR";"International Conference on Logic Programming and Non-monotonic Reasoning";"CORE2023";"B";"Artificial intelligence"
"LREC";"Language Resources and Evaluation Conference";"CORE2023";"B";"Artificial intelligence"
"M2VIP";"Mechatronics and Machine Vision in Practice";"CORE2018";"B";"Machine learning"
"MDAI";"International Conference on Modelling Decisions for Artificial Intelligence";"CORE2023";"B";"Artificial intelligence"
"MDM";"International Conference on Mobile Data Management";"CORE2023";"B";"Data management and data science"
"MMM";"International Conference on Multimedia Modelling";"CORE2023";"B";"Computer vision and multimedia computation"
"NAACL";"North American Association for Computational Linguistics";"CORE2023";"A";"Artificial intelligence"
"NeurIPS";"Advances in Neural Information Processing Systems";"CORE2023";"A*";"Machine learning"
"PAKDD";"Pacific-Asia Conference on Knowledge Discovery and Data Mining";"CORE2023";"B";"Data management and data science"
"PODS";"ACM SIGMOD-SIGACT-SIGART Conference on Principles of Database Systems";"CORE2023";"A*";"Data management and data science"
"PPSN";"Parallel Problem Solving from Nature";"CORE2023";"A";"Machine learning"
"PRICAI";"Pacific Rim International Conference on Artificial Intelligence";"CORE2023";"B";"Artificial intelligence"
"PRIMA";"International Conference on Principles of Practice in Multi-Agent Systems";"CORE2023";"B";"Artificial intelligence"
"RSS";"Robotics: Science and Systems";"CORE2018";"A*";"Machine learning"
"RecSys";"ACM International Conference on Recommender Systems";"CORE2023";"A";"Data management and data science"
"RuleML+RR";"International Joint Conference on Rules and Reasoning";"CORE2023";"B";"Artificial intelligence"
"SAT";"International Conference on Theory and Applications of Satisfiability Testing";"CORE2023";"A";"Artificial intelligence"
"SDM";"SIAM International Conference on Data Mining";"CORE2023";"A";"Data management and data science"
"SIGIR";"ACM International Conference on Research and Development in Information Retrieval";"CORE2023";"A*";"Data management and data science"
"SIGMOD";"ACM Special Interest Group on Management of Data Conference";"CORE2023";"A*";"Data management and data science"
"SIGdial";"Annual Meeting of the Special Interest Group on Discourse and Dialog";"CORE2023";"B";"Artificial intelligence"
"SISAP";"International Conference on Similarity Search and Applications";"CORE2023";"B";"Data management and data science"
"SSDBM";"International Conference on Scientific and Statistical Data Base Management";"CORE2023";"B";"Data management and data science"
"SSPR";"Structural and Syntactical Pattern Recognition";"CORE2023";"B";"Computer vision and multimedia computation"
"SoCS";"The Symposium of Combinatorial Search";"CORE2023";"B";"Artificial intelligence"
"TPDL";"International Conference on Theory and Practice of Digital Libraries";"CORE2023";"B";"Data management and data science"
"UAI";"Conference in Uncertainty in Artificial Intelligence";"CORE2023";"A";"Artificial intelligence"
"VLDB";"International Conference on Very Large Databases";"CORE2023";"A*";"Data management and data science"
"WACV";"IEEE Workshop on Applications of Computer Vision";"CORE2023";"A";"Computer vision and multimedia computation"
"WI";"IEEE/WIC/ACM International Conference on Web Intelligence";"CORE2023";"B";"Artificial intelligence"
"WISE";"International Conference on Web Information Systems Engineering";"CORE2023";"B";"Data management and data science"
"WSDM";"ACM International Conference on Web Search and Data Mining";"CORE2023";"A";"Data management and data science"
